KO,30313,Consumer Defensive,79000,"The Coca-Cola Company, a beverage company, manufactures, markets, and sells various nonalcoholic beverages worldwide. The company provides sparkling soft drinks; flavored and enhanced water, and sports drinks; juice, dairy, and plantbased beverages; tea and coffee; and energy drinks. It also offers beverage concentrates and syrups, as well as fountain syrups to fountain retailers, such as restaurants and convenience stores. The company sells its products under the Coca-Cola, Diet Coke/Coca-Cola Light, Coca-Cola Zero Sugar, Fanta, Fresca, Schweppes, Sprite, Thums Up, Aquarius, Ciel, dogadan, Dasani, glacéau smartwater, glacéau vitaminwater, Ice Dew, I LOHAS, Powerade, Topo Chico, AdeS, Del Valle, fairlife, innocent, Minute Maid, Minute Maid Pulpy, Simply, Ayataka, BODYARMOR, Costa, FUZE TEA, Georgia, and Gold Peak brands. It operates through a network of independent bottling partners, distributors, wholesalers, and retailers, as well as through bottling and distribution operators. The company was founded in 1886 and is headquartered in Atlanta, Georgia.",Atlanta,404 676 2121,GA,United States,[],https://www.coca-colacompany.com,1,One Coca-Cola Plaza,Beverages—Non-Alcoholic,0.32012,0.23162001,0.58894,11646000128,0.118,0.28746998,13228000256,63,buy,23298000000,7478499840,70,59.26,-0.279,1.127,0.080979995,22,69.8,172.628,0.39211,76,11619000320,42816999424,41322000384,2.687,USD,9.553,0.785,2.1,NYQ,Coca-Cola Company (The),The Coca-Cola Company,America/New_York,EDT,False,-14400000,EQUITY,KO,finmb_26642,us_market,,7.015,,21.914,0.0996474,,2.6,,4324630016,,,,5.318,26862720,0.0062,,1640908800,0.7133,9571000320,2.2,0.44,-0.15654653,11.143287,0.00661,1703980800,,1656633600,2.77,1659052800,3894458310,0.544546,289878966272,2,,1344816000,2:1,,1663200000,,-0.279,6.201964,1661904000,4.36,,22.792309,,0.0063,26732776,0,,,59.4,59.55,61.8669,0.028956229,0.78180003,,59.73,,13864120,59.4,62.6026,1.72,59.55,,13864120,,,1.76,1663200000,,,59.2,USD,26.936363,11353675,,,,256277561344,,,12345795,59.2,0,3000,11353675,67.2,,3.14,52.28,0,False,0.0296,3000,59.73,,59.26,59.3,https://logo.clearbit.com/coca-colacompany.com,3.3389
MCD,60607,Consumer Cyclical,100000,"McDonald's Corporation operates and franchises McDonald's restaurants in the United States and internationally. Its restaurants offer hamburgers and cheeseburgers, chicken sandwiches and nuggets, wraps, fries, salads, oatmeal, shakes, desserts, sundaes, soft serve cones, bakery items, soft drinks, coffee, and beverages and other beverages, as well as breakfast menu, including biscuit and bagel sandwiches, breakfast burritos, hotcakes, and other sandwiches. As of December 31, 2021, the company operated 40,031 restaurants. McDonald's Corporation was founded in 1940 and is headquartered in Chicago, Illinois.",Chicago,630 623 3000,IL,United States,[],https://corporate.mcdonalds.com,1,110 North Carpenter Street,Restaurants,0.5116,0.25773,0.55287,8035700224,-0.029,0.43138,12070899712,250,buy,12580200000,5407974912,285,247.94,-0.458,1.414,0.12579,33,282.88,,,328,1938599936,47646400512,23594399744,2.635,USD,31.747,1.085,2,NYQ,McDonald's Corporation,McDonald's Corporation,America/New_York,EDT,False,-14400000,EQUITY,MCD,finmb_139488,us_market,,9.766,,19.09,0.0061683655,,10.59,,735716992,,,,-8.658,5651733,0.0077,,1640908800,0.69777,6081099776,8.12,1.38,-0.15654653,,0.0017,1703980800,,1656547200,2.7,1659052800,734687267,0.570115,230431686656,2,,920851200,2:1,,1661904000,,-0.465,7.7312274,1661904000,3.55,,23.412653,,0.0077,6071707,0,,,251.08,255.13,252.02115,0.021626573,0.66870004,,250.43,,2522700,251.08,258.1852,5.43,255.13,,2522700,,,5.52,1661904000,,,247.65,USD,30.534483,2154022,,,,182413672448,,,2366314,247.65,0,900,2154022,271.15,,2.3,217.68,0,False,0.022,1000,250.43,,247.94,,https://logo.clearbit.com/corporate.mcdonalds.com,3.3585
MMM,55144-1000,Industrials,95000,"3M Company operates as a diversified technology company worldwide. It operates through four segments: Safety and Industrial; Transportation and Electronics; Health Care; and Consumer. The Safety and Industrial segment offers industrial abrasives and finishing for metalworking applications; autobody repair solutions; closure systems for personal hygiene products, masking, and packaging materials; electrical products and materials for construction and maintenance, power distribution, and electrical original equipment manufacturers; structural adhesives and tapes; respiratory, hearing, eye, and fall protection solutions; and natural and color-coated mineral granules for shingles. The Transportation and Electronics segment provides ceramic solutions; attachment tapes, films, sound, and temperature management for transportation vehicles; premium large format graphic films for advertising and fleet signage; light management films and electronics assembly solutions; packaging and interconnection solutions; and reflective signage for highway, and vehicle safety. The Healthcare segment offers food safety indicator solutions; health care procedure coding and reimbursement software; skin, wound care, and infection prevention products and solutions; dentistry and orthodontia solutions; and filtration and purification systems. The Consumer segment provides consumer bandages, braces, supports and consumer respirators; cleaning products for the home; retail abrasives, paint accessories, car care DIY products, picture hanging, and consumer air quality solutions; and stationery products. It offers its products through e-commerce and traditional wholesalers, retailers, jobbers, distributors, and dealers. The company was founded in 1902 and is based in St. Paul, Minnesota.",Saint Paul,651 733 1110,MN,United States,[],https://www.3m.com,1,3M Center,Conglomerates,0.24558,0.11828,0.44526002,6016999936,-0.028,0.19131,8615999488,120,hold,16579000000,3868499968,140,114.14,-0.947,1.467,0.08931,18,142.52,124.464,0.2938,210,2984000000,17195999232,35085000704,5.239,USD,61.076,0.798,3.3,NYQ,3M Company,3M Company,America/New_York,EDT,False,-14400000,EQUITY,MMM,finmb_289194,us_market,,2.271,,9.248,-0.36953157,,10.9,,553614016,,,,24.126,103797531,0.1822,,1640908800,0.66903996,4150000128,7.16,1.49,-0.15654653,4.7309957,0.0011999999,1703980800,,1656547200,7.82,1659052800,569028628,0.994806,79682224128,2,,1064880000,2:1,,1660867200,,-0.949,1.8010404,1661904000,27.5,,10.47156,,0.1825,8027775,0,,,114.81,116.83,148.53944,0.051737655,0.8296,,115.05,,8470150,114.81,133.735,5.94,116.83,,8470150,,,5.96,1660867200,,,113.43,USD,15.941341,3569718,,,,63189504000,,,9664976,113.43,0,900,3569718,186.3,,3.19,113.43,0,False,0.0519,800,115.05,,114.14,113.47,https://logo.clearbit.com/3m.com,1.8242
MRK,07033,Healthcare,67000,"Merck & Co., Inc. operates as a healthcare company worldwide. It operates through two segments, Pharmaceutical and Animal Health. The Pharmaceutical segment offers human health pharmaceutical products in the areas of oncology, hospital acute care, immunology, neuroscience, virology, cardiovascular, and diabetes, as well as vaccine products, such as preventive pediatric, adolescent, and adult vaccines. The Animal Health segment discovers, develops, manufactures, and markets veterinary pharmaceuticals, vaccines, and health management solutions and services, as well as digitally connected identification, traceability, and monitoring products. It serves drug wholesalers and retailers, hospitals, and government agencies; managed health care providers, such as health maintenance organizations, pharmacy benefit managers, and other institutions; and physicians and physician distributors, veterinarians, and animal producers. The company has collaborations with AstraZeneca PLC; Bayer AG; Eisai Co., Ltd.; Ridgeback Biotherapeutics; and Gilead Sciences, Inc. to jointly develop and commercialize long-acting treatments in HIV. Merck & Co., Inc. was founded in 1891 and is headquartered in Kenilworth, New Jersey.",Kenilworth,908 740 4000,NJ,United States,[],https://www.merck.com,1,2000 Galloping Hill Road,Drug Manufacturers—General,0.41073,0.29,0.70769,18890999808,0.28,0.34911,23480999936,85,buy,35463000000,10303750144,100.5,87.51,1.541,1.386,0.12614,20,100.85,73.094,0.43415,125,10129000448,31662999552,57168998400,3.998,USD,22.61,0.911,2.2,NYQ,"Merck & Company, Inc.","Merck & Co., Inc.",America/New_York,EDT,False,-14400000,EQUITY,MRK,finmb_288502,us_market,,4.124,,10.04,0.188833,,7.43,,2533280000,,,,17.07,19293573,0.0076,,1640908800,0.76267,16641000448,6.55,0.69,-0.15654653,5.126538,0.0010800001,1703980800,,1656547200,2.5,1659052800,2530138578,0.336396,235747147776,2,,1622678400,1048:1000,,1663113600,,1.553,3.8777544,1661904000,1.1,,11.777928,,0.0076,16789912,0,,,84.53,84.55,84.6628,0.03170472,0.41529998,,88.15,,8647240,84.53,88.9864,2.68,84.55,,8647240,,,2.76,1663113600,,,84.55,USD,13.360305,11377906,,,,221687332864,,,8847495,84.55,0,1000,11377906,95.72,,3,71.5,0,False,0.0327,1100,88.15,,87.51,87.64,https://logo.clearbit.com/merck.com,
MSFT,98052-6399,Technology,221000,"Microsoft Corporation develops, licenses, and supports software, services, devices, and solutions worldwide. The company operates in three segments: Productivity and Business Processes, Intelligent Cloud, and More Personal Computing. The Productivity and Business Processes segment offers Office, Exchange, SharePoint, Microsoft Teams, Office 365 Security and Compliance, Microsoft Viva, and Skype for Business; Skype, Outlook.com, OneDrive, and LinkedIn; and Dynamics 365, a set of cloud-based and on-premises business solutions for organizations and enterprise divisions. The Intelligent Cloud segment licenses SQL, Windows Servers, Visual Studio, System Center, and related Client Access Licenses; GitHub that provides a collaboration platform and code hosting service for developers; Nuance provides healthcare and enterprise AI solutions; and Azure, a cloud platform. It also offers enterprise support, Microsoft consulting, and nuance professional services to assist customers in developing, deploying, and managing Microsoft server and desktop solutions; and training and certification on Microsoft products. The More Personal Computing segment provides Windows original equipment manufacturer (OEM) licensing and other non-volume licensing of the Windows operating system; Windows Commercial, such as volume licensing of the Windows operating system, Windows cloud services, and other Windows commercial offerings; patent licensing; and Windows Internet of Things. It also offers Surface, PC accessories, PCs, tablets, gaming and entertainment consoles, and other devices; Gaming, including Xbox hardware, and Xbox content and services; video games and third-party video game royalties; and Search, including Bing and Microsoft advertising. The company sells its products through OEMs, distributors, and resellers; and directly through digital marketplaces, online stores, and retail stores. Microsoft Corporation was founded in 1975 and is headquartered in Redmond, Washington.",Redmond,425 882 8080,WA,United States,[],https://www.microsoft.com,1,One Microsoft Way,Software—Infrastructure,0.49418998,0.36686,0.68402,89034997760,0.124,0.42055,97982996480,275,buy,135620000000,49479000064,330,240.98,0.031,1.785,0.14919,46,339.48,47.075,0.47151002,425.96,104748998656,78399995904,198269992960,14.045,USD,26.45,1.567,1.7,NMS,Microsoft Corporation,Microsoft Corporation,America/New_York,EDT,True,-14400000,EQUITY,MSFT,finmb_21835,us_market,,10.427,,21.099,,,8.35,,7507979776,,,,17.853,38999356,0.0052,,1656547200,0.72120005,72737996800,7.338,,,13.498011,0.00075,1719705600,,1656547200,1.42,1655251200,7450956033,0.932311,2067379519488,2,,1045526400,2:1,,,,0.017,9.1252985,1657843200,1.73,,28.859879,,0.0052,48150433,,,,238.95,237.8704,284.84424,0.009165098,0.2508,,243.86,,28255370,238.95,267.6062,2.19,237.8704,,28255370,,,2.48,1660694400,,,237.57,USD,32.84001,31061162,,,,1809272930304,,,24509800,237.57,0,900,31061162,349.67,,1.23,237.57,0,False,0.0088,800,243.86,,240.98,240.16,https://logo.clearbit.com/microsoft.com,
NKE,97005-6453,Consumer Cyclical,79100,"NIKE, Inc., together with its subsidiaries, designs, develops, markets, and sells men's, women's, and kids athletic footwear, apparel, equipment, and accessories worldwide. The company provides athletic and casual footwear, apparel, and accessories under the Jumpman trademark; and casual sneakers, apparel, and accessories under the Converse, Chuck Taylor, All Star, One Star, Star Chevron, and Jack Purcell trademarks. In addition, it sells a line of performance equipment and accessories comprising bags, socks, sport balls, eyewear, timepieces, digital devices, bats, gloves, protective equipment, and other equipment for sports activities under the NIKE brand; and various plastic products to other manufacturers. The company markets apparel with licensed college and professional team, and league logos, as well as sells sports apparel. Additionally, it licenses unaffiliated parties to manufacture and sell apparel, digital devices, and applications and other equipment for sports activities under NIKE-owned trademarks. The company sells its products to footwear stores; sporting goods stores; athletic specialty stores; department stores; skate, tennis, and golf shops; and other retail accounts through NIKE-owned retail stores, digital platforms, independent distributors, licensees, and sales representatives. The company was formerly known as Blue Ribbon Sports, Inc. and changed its name to NIKE, Inc. in 1971. NIKE, Inc. was founded in 1964 and is headquartered in Beaverton, Oregon.",Beaverton,503 671 6453,OR,United States,[],https://investors.nike.com,1,One Bowerman Drive,Footwear & Accessories,0.16089001,0.12944001,0.45984,5187999744,-0.009,0.1429,7514999808,96,buy,21479000000,2899000064,130,98.55,-0.043,2.629,0.10689,31,139.1,82.632,0.43112,203,12997000192,12627000320,46710001664,8.286,USD,29.586,1.646,2.1,NYQ,"Nike, Inc.","NIKE, Inc.",America/New_York,EDT,True,-14400000,EQUITY,NKE,finmb_291981,us_market,,3.851,,23.937,,,3.94,,1277810048,,,,7.551,14864348,0.0095,,1653955200,0.83238,6046000128,2.139,,,13.051251,0.012410001,1717113600,,1653955200,1.64,1655251200,1247692109,1.005534,179888439296,2,,1450915200,2:1,,,,-0.046,3.3394759,1657843200,2.43,,25.012691,,0.0150999995,12853572,,,,99.79,99.79,126.79405,0.010421885,0.3173,,100.21,,6653560,99.79,109.6694,1.04,99.79,,6653560,,,1.22,1654214400,,,97.83,USD,46.072933,9509277,,,,155986919424,,,6975038,97.83,0,1200,9509277,179.1,,0.95,97.83,0,False,0.0106,900,100.21,,98.55,,https://logo.clearbit.com/investors.nike.com,
PG,45202,Consumer Defensive,,"The Procter & Gamble Company provides branded consumer packaged goods worldwide. It operates through five segments: Beauty; Grooming; Health Care; Fabric & Home Care; and Baby, Feminine & Family Care. The Beauty segment offers conditioners, shampoos, styling aids, and treatments under the Head & Shoulders, Herbal Essences, Pantene, and Rejoice brands; and antiperspirants and deodorants, personal cleansing, and skin care products under the Olay, Old Spice, Safeguard, Secret, and SK-II brands. The Grooming segment provides shave care products and appliances under the Braun, Gillette, and Venus brand names. The Health Care segment offers toothbrushes, toothpastes, and other oral care products under the brand names of Crest and Oral-B; and gastrointestinal, rapid diagnostics, respiratory, vitamins/minerals/supplements, pain relief, and other personal health care products under the Metamucil, Neurobion, Pepto-Bismol, and Vicks brands. The Fabric & Home Care segment provides fabric enhancers, laundry additives, and laundry detergents under the Ariel, Downy, Gain, and Tide brands; and air care, dish care, P&G professional, and surface care products under the Cascade, Dawn, Fairy, Febreze, Mr. Clean, and Swiffer brands. The Baby, Feminine & Family Care segment offers baby wipes, taped diapers, and pants under the Luvs and Pampers brands; adult incontinence and feminine care products under the Always, Always Discreet, and Tampax brands; and paper towels, tissues, and toilet papers under the Bounty, Charmin, and Puffs brands. The company sells its products primarily through mass merchandisers, e-commerce, grocery stores, membership club stores, drug stores, department stores, distributors, wholesalers, specialty beauty stores, high-frequency stores, pharmacies, electronics stores, and professional channels, as well as directly to consumers. The Procter & Gamble Company was founded in 1837 and is headquartered in Cincinnati, Ohio.",Cincinnati,513 983 1100,OH,United States,[],https://www.pginvestor.com,1,One Procter & Gamble Plaza,Household & Personal Products,0.25715,0.18384,0.47427,16723000320,0.03,0.22214001,20619999232,124,buy,38030000000,9285749760,159,136.21,0.071,0.655,0.09413999,22,158.61,67.215,0.3164,180,7214000128,31492999168,80186998784,3.013,USD,32.636,0.374,2.4,NYQ,Procter & Gamble Company (The),The Procter & Gamble Company,America/New_York,EDT,True,-14400000,EQUITY,PG,finmb_33328,us_market,,4.45,,17.304,,,5.96,,2419950080,,,,18.676,13555712,0.0056,,1656547200,0.65742993,14741999616,5.439,,,7.293318,0.00116,1719705600,,1656547200,1.76,1655251200,2391242771,0.386121,356815634432,2,,1087776000,2:1,,,,0.05,4.110659,1657843200,5.52,,22.854029,,0.0057,17561811,,,,135.73,135.74,150.88126,0.023303619,0.60830003,,137.07,,6250220,135.73,142.7386,3.163,135.74,,6250220,,,3.65,1658361600,,,135.24,USD,25.043207,4968472,,,,329621405696,,,6535107,135.24,0,1100,4968472,165.35,,2.68,129.5,0,False,0.026300002,900,137.07,,136.21,,https://logo.clearbit.com/pginvestor.com,
TRV,10017,Financial Services,30184,"The Travelers Companies, Inc., through its subsidiaries, provides a range of commercial and personal property, and casualty insurance products and services to businesses, government units, associations, and individuals in the United states and internationally. The company operates through three segments: Business Insurance, Bond & Specialty Insurance, and Personal Insurance. The Business Insurance segment offers workers' compensation, commercial automobile and property, general liability, commercial multi-peril, employers' liability, public and product liability, professional indemnity, marine, aviation, onshore and offshore energy, construction, terrorism, personal accident, and kidnap and ransom insurance products. This segment operates through select accounts, which serve small businesses; commercial accounts that serve mid-sized businesses; national accounts, which serve large companies; and national property and other that serve large and mid-sized customers, commercial trucking industry, and agricultural businesses, as well as markets and distributes its products through brokers, wholesale agents, and program managers. The Bond & Specialty Insurance segment provides surety, fidelity, management and professional liability, and other property and casualty coverages and related risk management services through independent agencies and brokers. The Personal Insurance segment offers property and casualty insurance covering personal risks, primarily automobile and homeowners insurance to individuals through independent agencies and brokers. The Travelers Companies, Inc. was founded in 1853 and is based in New York, New York.",New York,917 778 6000,NY,United States,[],https://www.travelers.com,1,485 Lexington Avenue,Insurance—Property & Casualty,0.15349,0.099659994,0.26227,6876000256,0.052,0.12933,5488999936,158,hold,9475000000,14155875328,176,157,-0.38,0.343,0.02446,17,175.12,31.875,0.137,190,4279000064,7290999808,35761000448,18.031,USD,147.377,0.175,2.8,NYQ,"The Travelers Companies, Inc.","The Travelers Companies, Inc.",America/New_York,EDT,True,-14400000,EQUITY,TRV,finmb_392856,us_market,,1.137,,7.41,,,12.28,,246008992,,,,112.402,3454111,0.0146,,1640908800,0.85094,3537999872,11.062,,,1.3967723,0.0021,1703980800,,1656547200,2.88,1655251200,236394717,0.704129,40673591296,2,,894931200,2:1,,,,-0.41,1.0800428,1657843200,1.9,,12.785017,,0.0146,3007035,,,,157.06,157.83,168.486,0.02164778,0.2481,,158.14,,1412940,157.06,162.8532,3.4,157.83,,1412940,,,3.72,1662595200,,,155.54,USD,14.192732,1113298,,,,38623412224,,,1188220,155.54,160.44,1100,1113298,187.98,,2.34,145.4,0,False,0.0234,800,158.14,,157,,https://logo.clearbit.com/travelers.com,
UNH,55343,Healthcare,350000,"UnitedHealth Group Incorporated operates as a diversified health care company in the United States. It operates through four segments: UnitedHealthcare, Optum Health, Optum Insight, and Optum Rx. The UnitedHealthcare segment offers consumer-oriented health benefit plans and services for national employers, public sector employers, mid-sized employers, small businesses, and individuals; health care coverage and well-being services to individuals age 50 and older addressing their needs for preventive and acute health care services, as well as services dealing with chronic disease and other specialized issues for older individuals; Medicaid plans, children's health insurance and health care programs; health and dental benefits; and hospital and clinical services. The OptumHealth segment provides access to networks of care provider specialists, health management services, care delivery, consumer engagement, and financial services. This segment serves individuals directly through care delivery systems, employers, payers, and government entities. The OptumInsight segment offers software and information products, advisory consulting arrangements, and managed services outsourcing contracts to hospital systems, physicians, health plans, governments, life sciences companies, and other organizations. The OptumRx segment provides pharmacy care services and programs, including retail network contracting, home delivery, specialty and compounding pharmacy, and purchasing and clinical capabilities, as well as develops programs in the areas of step therapy, formulary management, drug adherence, and disease/drug therapy management. UnitedHealth Group Incorporated was incorporated in 1977 and is based in Minnetonka, Minnesota.",Minnetonka,952 936 1300,MN,United States,[],https://www.unitedhealthgroup.com,1,UnitedHealth Group Center,Healthcare Plans,0.08993,0.05954,0.24008,22987999232,0.126,0.08264,27569000448,360,buy,69652000000,17796749312,587,517.46,0.197,0.771,0.0719,25,572.87,63.346,0.24253,632,27964000256,51391000576,306560991232,29.436,USD,325.782,0.526,1.8,NYQ,UnitedHealth Group Incorporated,UnitedHealth Group Incorporated,America/New_York,EDT,True,-14400000,EQUITY,UNH,finmb_104673,us_market,,1.773,,19.717,,,21.37,,941851008,,,,72.427,5678002,0.0061000003,,1640908800,0.8962,18254000128,17.588,,,7.144573,0.00548,1703980800,,1656547200,1.33,1655251200,945345000,0.774372,543572000768,2,,1117497600,2:1,,,,0.188,1.5897986,1657843200,1.73,,24.21432,,0.0061000003,5760909,,,,512.08,511.03,502.1295,0.0097640995,0.31350002,,520.97,,2741370,512.08,529.8306,5,511.03,,2741370,,,6.6,1655337600,,,506.1101,USD,29.421198,2268739,,,,487370227712,,,2779731,506.1101,0,800,2268739,553.29,,1.36,383.12,0,False,0.012200001,1000,520.97,,517.46,,https://logo.clearbit.com/unitedhealthgroup.com,
V,94128-8999,Financial Services,21500,"Visa Inc. operates as a payments technology company worldwide. The company facilitates digital payments among consumers, merchants, financial institutions, businesses, strategic partners, and government entities. It operates VisaNet, a transaction processing network that enables authorization, clearing, and settlement of payment transactions. In addition, the company offers card products, platforms, and value-added services. It provides its services under the Visa, Visa Electron, Interlink, VPAY, and PLUS brands. Visa Inc. has a strategic agreement with Ooredoo to provide an enhanced payment experience for Visa cardholders and Ooredoo customers in Qatar. Visa Inc. was founded in 1958 and is headquartered in San Francisco, California.",San Francisco,650 432 3200,CA,United States,[],https://usa.visa.com,1,PO Box 8999,Credit Services,0.70465,0.51994,0.97329,16944000000,0.187,0.67485,19787999232,204,buy,23375000000,12285375488,261.6,185.79,0.359,1.427,0.14094,38,259.96,67.06,0.39854,296,17355999232,23794999296,28081999872,8.388,USD,13.391,1.046,1.8,NYQ,Visa Inc.,Visa Inc.,America/New_York,EDT,True,-14400000,EQUITY,V,finmb_38043467,us_market,,15.96,,22.649,,,7.06,,,,,,16.084,34263343,0.0162,,1632960000,0.9779,14273999872,4.838,,,11.55123,0.00164,1696032000,,1656547200,5.52,1655251200,1633503157,0.896977,448175243264,2,,1426723200,4:1,,,,0.325,,1657843200,1.62,,26.315863,,0.0208,32636801,,,,187.02,186.35,210.0744,0.006737247,0.21280001,,187.21,,6077880,187.02,206.4582,1.26,186.35,,6077880,,,1.5,1652313600,,,184.66,USD,38.402233,6603762,,,,,,,5750488,184.66,0,1100,6603762,236.96,,0.6,184.66,0,False,0.0070999996,1000,187.21,,185.79,186.34,https://logo.clearbit.com/usa.visa.com,
